921,"Magnificent - The Most Beautiful Woman of Wano, Komurasaki"
922,A Tale of Chivalry! Zoro and Tonoyasu's Little Trip!
923,A State of Emergency - Big Mom Closes in!
924,The Capital in an Uproar! Another Assassin Targets Sanji!
925,Great Success - Justice of O-Soba Mask!
926,Desperate Situation - The Threatful Orochi Oniwabanshu
927,A State of Chaos - Fearsome Snake Shogun Orochi
928,The Flower Falls! The Final Moment of the Most Beautiful Woman in Wano Country
929,Conciliation of Prisoners - Luffy and Grandpa Hyo!
930,All-Star! Queen the Plague Appears!
931,Climb - Luffy's Fleeing Play!
932,Dead or Alive - Queen's Sumo Inferno
933,Gyukimaru! Zoro Fights a Duel on Oihagi Bridge
934,Great Reversal - Santoryu Beyond the Deadline !
935,Amazement of Zoro - True Identity of the Mysterious Beauty
936,"Approach - Ryuo, the Haki of Wano Country"
937,A Lame Yasu - The Star of Ebisu Town
938,Meet Easily - Identity of Ushimitsu Kozo
939,Malediction - Departure in Song of Tonoyasu
940,Cruelty - The Reality of SMILE Devil Fruit!
941,Toko's Tears - Orochi's Painful Bullets!
942,The Straw Hats Intrudes! Uproar! A Fierce Battle at the Execution Room
943,Luffy?s Determination - Breakthrough the Grand Sumo's Hell!
944,The Coming of the Storm! Big Mom's Great Rampage!
945,A Grudge Over Oshiruko - Luffy Gets into a Desperate Situation
946,Stop the Emperor of the Sea! Queen's Secret Plan!
947,Brutal Ammunition! The Plague Rounds Aim at Luffy!
948,Start Fighting Back! Luffy and the Red Scabbard Samurai!
949,We're Here to Win! Luffy's Desperate Scream!
950,The Warriors' Dreams - Takeover of Udon
951,Orochi's Pursuers! Ninja Army Corps vs. Zoro
952,Tensions on Onigashima! Encounter?! The Two Emperors
953,Hiyori's Confession! Reunion on Oihagi Bridge
954,Its Name is Enma! Oden's Meito!
955,A New Alliance?! Kaido's Army Great Assemble
956,Decisive Battle Draws Near! The Straw Hat Crew Ready for Battle
957,Big News! The Warlords Attack Incident
958,The Legendary Battle! Garp and Roger
959,The Promised Port! Wano Country Arc Act 3 Opening
960,The Best Samurai in Wano Country! Kozuki Oden Appears
961,Tearful Apprentice - Oden and Kin'emon
962,Moving Fate Drift Ashore! Whitebeard Pirates!
963,Oden's Determination! Whitebeard's Trials!
964,Whitebeard's Little Brother! Oden's Great Adventure!
965,Blades Crossed! Roger and Whitebeard!
966,Roger's Wish! A New Adventure Begins!
967,The Bet of a Lifetime! Roger's Adventure
968,The Pirate King is Born - Arriving at the Last Island!
969,To the Land of Wano! The Roger Pirates Disband!
970,Sad News - The Opening of the Great Pirate Era
971,Raid! Oden and the Nine Red Scabbards
972,The Moment of Conclusion! Oden vs. Kaido!
973,Sentenced to Boil - Oden's Deadly Hour
974,"I'm Oden, and I Was Born to Boil"
975,The Burning Castle! The Fate of the Kozuki Clan!
976,Back to the Present! Beyond 20 Years
977,Pirates at Sea! Raid! Onward to Onigashima
978,The Worst Generation Charges in! The Battle of the Stormy Sea
979,Strong Luck!? Leader Kin'emon's Plan
980,Promise of Tears! The Kidnapped Momonosuke
981,A New Companion! Knight of the Sea Jinbe!
982,Kaido's Trump Card - Introducing the Tobi Roppo
983,The Seriousness of the Samurai! The Crew Lands on Onigashima
984,Luffy Goes Out of Control?! Sneaking into Kaido's Banquet
985,Feelings Toward O-tama - Luffy's Furious Blow
986,Fighting Music! The Ability to Attack Luffy!
987,The Failing Dream? The Plot to Lure Sanji!
988,Arrival of Reinforcements! Captain of the Whitebeard Pirates!
989,Oath of Man! Fierce Battle of the Brachiotank
990,Thunder Bagua! The Appearance of Kaido's Son
991,Enemy or Ally? Luffy and Yamato!
992,I Want to Become Oden - Yamato's Desire
993,Explosive?! The Handcuffs that Shackle Yamato's Freedom!
994,The Scabbards Face-off - Kikunojo vs. Kanjuro
995,Raid! Inheriting the Will of Oden
996,Onigashima in Tumult- Luffy's All-Out War Begins
997,"Moonlight Battle - Berserker ""Sulong"""
998,The Rebellion of Zeus?! Nami's Desperate Situation!
999,I'll Protect You - Chance Encounter Yamato and Momonosuke
1000,Overwhelming Strength! The Straw Hat Pirates Gather
1001,A Dangerous Invitation! Plan to Eradicate Queen
1002,A New Connection! Nami and Ulti!
1003,"A Heroic Blade! The Red Scabbards vs. Kaido, Again Once More"
1004,An Inherited Technique - Unleashing Oden's Secret Swordplay
1005,The Power of Ice Oni! A New Version of the Excite Bullets
1006,I Won't Forgive You! Chopper's Determination!
1007,Zoro's Pursuit! Ice Oni Tag
1008,Nami's Surrender?! Ulti's Wild Headbutt
1009,Sasaki's Onslaught - Armored Division vs. Yamato
1010,Eliminate the Ice Oni - Chopper's Fire Trick!
1011,It's Not Okay!! The Spider That Lures Sanji
1012,A Comeback Move! Marco The Phoenix's Flame
1013,Yamato's Past ? The Man Aiming for an Emperor's Head
1014,Marco's Tears! The Bond of the Whitebeard Pirates
1015,Straw Hat Luffy - The Man Who Will Become the Pirate King
1016,The Battle of the Monsters! The Three Stubborn Captains
1017,A Barrage of Powerful Techniques! The Fierce Attacks of the Worst Generation!
1018,Kaido Laughs! Four Emperors vs. New Generation!
1019,Otama's Secret Plan! Great Operation Kibi Dango
1020,Sanji's Scream! An SOS Echoes Over the Island
1021,Spank Strikes! Sanji's Woman-trouble!
1022,No Regrets - The Student and Teacher Bond Between Luffy and the Boss
1023,Preparations OK! Chopperphage Nebulizer
1024,Oden Appears! The Confused Hearts of the Red Scabbards!
1025,Annihilation of the Worst Generation!? The Powerful Techniques of the Four Emperors!
1026,The Supernovas Counterattack! The Four Emperors's Disassembly Operation
1027,Protect Luffy! Zoro and Law's Sword Technique
1028,Beyond the Four Emperors - Luffy's Iron Fist Counterattack
1029,A Faint Memory - Luffy and Red-Haired's Daughter Uta
1030,The Oath of the New Era! Luffy and Uta
1031,Nami's Screams - The Desperate Death Race!
1032,The Dawn of the Land of Wano - The All-Out Battle Heats Up!
1033,Settled! Luffy's Accelerating Fist of the Supreme King
1034,Luffy Defeated! The Straw Hats in Jeopardy?!
1035,The Beasts Trample Down! The End of the Kozuki Family!
1036,Fight Against the Dark Night! The Commander-in-Chief of the Land of Wano Sounds Off!
1037,Believe in Luffy! The Alliance's Counterattack Begins!
1038,Nami's Lethal Attack! O-Tama's Desperate Challenge!
1039,A Dramatic Increase of Allies! Straw Hats Fight Back!
1040,The Pride of a Helmsman - The Enraged Jinbe!
1041,Great Battle of Monsters! Yamato and Franky
1042,The Predator's Trap - Black Maria's Seduction
1043,Slash the Nightmare - Brook's Sword of Ice!
1044,"Clutch! A Demon Incarnate, Robin!"
1045,A Spell! Kid and Zoro Facing Threats!
1046,Taking a Chance! Both Wings Go into Battle!
1047,Ascend to the Dawn! A Pink Dragon Gets Agitated
1048,For the Future! Yamato and the Great Swordsmen's Pledge
1049,Luffy Soars! Revenge Against the King of the Beasts
1050,Two Dragons Face Off! Momonosuke's Determination!
1051,A Legend All Over Again! Luffy's Fist Roars in the Sky
1052,The Situation Has Grown Tense! The End of Onigashima!
1053,Sanji's Mutation ? The Two Arms in Crisis!
1054,Death to Your Partner! Killer's Deadly Gamble!
1055,A Shadowy Figure Pulls the Strings! Onigashima in Flames
1056,A Countercharge! Law and Kid's Return-Attack Combination
1057,For Luffy - Sanji and Zoro's Oath
1058,The Onslaught of Kazenbo - Orochi's Evil Clutches Close in
1059,Zoro's Hardship - A Monster! King the Wildfire
1060,Secrets of Enma! The Cursed Sword Entrusted to Zoro
1061,Attack of the Devil! Sanji VS Queen
1062,King of Hell Three Sword Style - Zoro vs. King
1063,Luffy Accelerates! The Turning Point of a New Era!
1064,Shuron Hakke! A Lawless Dragon Approaches Luffy!
1065,"The Destruction of the Alliance?! Fire up, the Will of the New Generation!"
1066,Here Comes Main Act! Powerful Techniques of Shockwave and Magnetism
1067,Towards A New Era! Conclusion! The Brats' Resolution
1068,Moon Princess Echoes! The Final Phase of Wano Country!
1069,There is Only One Winner - Luffy vs. Kaidou
1070,Luffy Defeated?! The Determination of the Left Behind
1071,Luffy?s Peak - Attained! Gear 5
1072,The Ridiculous Power! Gear 5 in Full Play
1073,No Escape! Inferno on Onigashima!
1074,Believe in Momo - Luffy's Final Big Move
1075,Twenty Years of Prayer! Reclaim Wano Country
1076,The World That Luffy Wants!
1077,Closing the Curtain! Winner - Straw Hat Luffy!
1078,Return! Shogun of Wano Country - Kozuki Momonosuke
